{
  "$schema": "../schema/v1/scenario.schema.json",
  "schema_version": "1",
  "name": "online-smoke",
  "seed": "6840227782638526188",
  "duration_ms": 60000,
  "topology": {
    "gateways": ["gateway-a"],
    "devices": ["device-a"]
  },
  "network_profile": {
    "latency_ms": 0,
    "jitter_ms": 0,
    "delivery_loss_rate": 0,
    "ack_loss_rate": 0,
    "duplicate_rate": 0
  },
  "events": []
}
