{
  "$schema": "../schema/v1/scenario.schema.json",
  "schema_version": "1",
  "name": "gateway-crash-after-send",
  "seed": "6840227782638526192",
  "duration_ms": 30000,
  "topology": {
    "gateways": ["gateway-a", "gateway-b"],
    "devices": ["device-a"]
  },
  "network_profile": {
    "latency_ms": 0,
    "jitter_ms": 0,
    "delivery_loss_rate": 0,
    "ack_loss_rate": 0,
    "duplicate_rate": 0
  },
  "events": [
    {
      "at_ms": 500,
      "type": "gateway_crash",
      "gateway_id": "gateway-a"
    }
  ]
}
